text;Hate.speech;Sexism;Body;Racism;Ideology;Homophobia;Origin;Religion;Health;OtherLifestyle;Migrants;Ageing
"RT @toquedeveludo: Agora um poema:
Eu sou sapatão. 
E sapatão sempre vou ser
Pq gosto de pepekas
E a sua eu quero comer.
";1;0;0;0;0;1;0;0;0;0;0;0
racismo está nos olhos de quem vê;1;0;0;1;0;0;0;0;0;0;0;0
principalmente minhas irmãs adoram falar o quanto eu sou feia e gorda e elas lindas e perfeitas;1;1;1;0;0;0;0;0;0;0;0;0
"""Deseja feliz dia das mulheres mas resto do ano fica classificando ""essa é feia"" ""essa é gorda"" ""essa é gostosa""
TA E DAI?????";1;1;0;0;0;0;0;0;0;0;0;0
Homem se verdade não tem dia pra comemorar! Todo dia é dia.;0;0;0;0;0;0;0;0;0;0;0;0
Mentira, mesmo sendo sapatao ja estou preocupada, porque vai que eu engravidei pelo vaso sanitario ;1;0;0;0;0;1;0;0;0;0;0;0
Tô gorda e n consigo emagrecer, certeza q minha gastrite tá piorando pq só passo mal, n tenho inglês fluente, n sei nadar, sou feia +;1;1;1;0;0;0;0;0;0;0;0;0
estou me sentindo jundiaiense já. fui pra faculdade e perguntei se a coxinha era de frango. a mulher faltou me chamar de burra dizendo que+;1;1;0;0;0;0;0;0;0;0;0;0
EU GOSTO É DE MULHER BONITA CHEIROSA BEM CUIDADA E BEM RESOLVIDA, CANHÃO PROBLEMATIZADOR DE SUVACO PELUDO NÃO TEM VEZ AQUI NÃO #PAZ;1;1;0;0;1;0;0;0;0;0;0;0
Essas mulher burra me da raiva;1;1;0;0;0;0;0;0;0;0;0;0
@anacarolinars zzzz completou com gorda, feia, só faltou o boba pra ser + 5a série;1;1;1;0;0;0;0;0;0;0;0;0
Tava pensando aqui e cara, como tem menina/mulher burra;1;1;0;0;0;0;0;0;0;0;0;0
Não vejo a hora da gorda feia da Roberta rala ;1;1;1;0;0;0;0;0;0;0;0;0
@santosluccc você não conhece os refugiados, não sabe a índole de cada um deles, não sabe nem se quer se há um terrorista lá;1;0;0;0;0;0;0;0;0;0;1;0
Mas o Paul G não desiste pq? Nem Angola conquistou quer conquistar América ? ;0;0;0;0;0;0;0;0;0;0;0;0
@alexandrekirwan Melhor forma de ajudar os refugiados é levar a cultura ocidental pra lá, não o contrário! Só estão espalhando o problema.;1;0;0;0;0;0;0;0;0;0;1;0
@tavasconcellos no Brasil tem candidato que diz em nome de Deus, e contra refugiados. Não ah nada mais contraditório;1;0;0;0;0;0;0;0;0;0;1;0
@Sumido_ ja vi um noia indo no balcão pedir pra trocar pq ele não gostava de cheddar hahahahahahahaha;0;0;0;0;0;0;0;0;0;0;0;0
@LeNaZZo os parametros para notas são complexos, em resumo: Marlene Mattos é 0, Monica Bellucci é 10 e vc só pegaria a partir do 5 bom...;1;1;0;0;0;0;0;0;0;0;0;0
se alguém quiser piteu, está aqui um grupo de fufas para vocês;1;0;0;0;0;1;0;0;0;0;0;0
@UniGEmpath Sim, mas sabes que no islão isto é sinal de submissão e de inferioridade face ao homem, quer as mulheres usem porque querem ou n;0;0;0;0;0;0;0;0;0;0;0;0
RT @olhosvioleta_: @MaBolsonaria feliz dia da mulher pra ti Lindeza ;0;0;0;0;0;0;0;0;0;0;0;0
Es gorda e feia —_ Obrigada  https://t.co/biNf3mq69u;1;1;1;0;0;0;0;0;0;0;0;0
RT @tordilho2: #SerMulherÉ Não ser homem https://t.co/ajLjesDTM9;1;1;0;0;0;0;0;0;0;0;0;0
"""não sou ateu, sou AGNÓSTICO""
GRANDE MERDA FIO, NÃO ACREDITA EM JESUS DE NAZARÉ PRA MIM NEM GENTE É #PAZ";1;0;0;0;1;0;0;0;0;0;0;0
Se essa mulher for excepcional na cozinha eu vou me sentir um lixo... sei nem quebrar um ovo direito! #MasterChefBR;0;0;0;0;0;0;0;0;0;0;0;0
"RT @JOAQUINVOLTOU: BRANCO RICO COM PROBLEMA NA JUSTIÇA: 
PODE TIRAR PHOTO SIM
NEGRO COM PROBLEMA NA JUSTIÇA: 
VERGONHA TIRAR SELF COM ELE _";1;0;0;1;0;0;0;0;0;0;0;0
queria lembrar que chamar a coleguinha de puta, feia, gorda, escrota e etc tbm é machismo;1;1;1;0;0;0;0;0;0;0;0;0
"RT @VitoriaHenrice: ""Oi, nós somos sapatão"" KKKKKKKKKKKKKKKKKK";1;0;0;0;0;1;0;0;0;0;0;0
"""As mulheres estão descobrindo que mulher é bom - coisa que os homens já sabem há séculos.""  #MulherDeVerdade";1;1;0;0;0;0;0;0;0;0;0;0
gente eu não sou latino só por ter nascido no brasil né, latinos são sujos, eu tomo banho;1;0;0;1;0;0;1;0;0;0;0;0
@Mih_ArmstrongL @otmar03 Ainda bem que eu nao sou um FEMINISTO (homem que defende feminismo)..eu defendo a mulher e _ https://t.co/pX2ITtdVTg;1;1;0;0;1;0;0;0;0;0;0;0
@zurcju seguir no tt é facíl, apresentar as amigas sapatão ngm quer kkkkkk;1;0;0;0;0;1;0;0;0;0;0;0
A U.E. não conseguiu cumprir o acordo de acolher 90 mil refugiados. Previsível depois de todos os acontecimentos em Paris.;0;0;0;0;0;0;0;0;0;0;0;0
"""83 negros mortos por dia no brasil"" e os brancos não morrem também???";1;0;0;1;0;0;0;0;0;0;0;0
RT @numiweb: Também queremos ver os sms do Paulo Portas sobre o negócio dos submarinos;0;0;0;0;0;0;0;0;0;0;0;0
Hei Jovem espinhudo! AXÉ NÃO! RESTART NÃO! LEGIÃO URBANA NÃO ! Tenha um mínimo de decência nessa vida ordinária que vc leva!;0;0;0;0;0;0;0;0;0;0;0;0
Palavra do dia que homem que é homem não diz: Fragrância.;1;1;0;0;0;0;0;0;0;0;0;0
RT @cusBahia: Dossiê: Sapatão é revolução! Existências e resistências das lesbianidades nas encruzilhadas subalternas. Até 26/03 https://t. _;1;0;0;0;0;1;0;0;0;0;0;0
@ronizeppelin pode crer, ofensivo isso;0;0;0;0;0;0;0;0;0;0;0;0
"@juliamionn @bibia_22 
""ela não gosta de você"" ""ela é muito feia e se acha"" ""faz baca"" ""gorda"" ""rodada"" 
nada
sei lá 
não
passo";1;1;1;0;0;0;0;0;0;0;0;0
@5gu Lá vem a gorda fazer chantagem emocional.;1;1;1;0;0;0;0;0;0;0;0;0
ainda bem que eu sou sapatão e não preciso disso;1;0;0;0;0;1;0;0;0;0;0;0
quem não gosta de AC/DC @fodemal e não é @homemdeverdade !;1;1;0;0;0;0;0;0;0;0;0;0
Globo mostrando que homem nai vale nada mesmo e mulher é burra iludida;1;1;0;0;0;0;0;0;0;0;0;0
"@ronanoliveira_ @jpriscilla26 Cuidado com a burra!  Proteçao na EDIÇÃO, mulher! O programa ta ""pintando"" ela como uma vitima e perseguida";1;1;0;0;0;0;0;0;0;0;0;0
Mulher em estádio de futebol só faz merda. Se pelo menos estivesse totalmente pelada, mas nem isso https://t.co/dKqMPBfgrJ;1;1;0;0;0;0;0;0;0;0;0;0
"Fátima Bernardes não pára de repetir ""o estrago que o homem branco causou"" ao chegar no Brasil. 
Vai estudar, vai, sua besta!";1;0;0;1;0;0;0;0;0;0;0;0
Trans nunca vai ser mulher, além de pinto eles tem coração;1;1;0;0;0;0;0;0;0;0;0;0
"RT @SentimentoGay_: ""Você é gay/sapatão mesmo?""
""Ué sim""
""Nossa não parece""
Como assim tá me chamando de hetero é isso mesmo??? Como pode m _";1;0;0;0;0;1;0;0;0;0;0;0
Cadê a caridade muçulmana? Emirados Árabes não recebem refugiados?;0;0;0;0;0;0;0;0;0;0;0;0
tem nada de gorda e feia, smp foi linda nenem —_   https://t.co/j1DnxATjkZ;1;1;1;0;0;0;0;0;0;0;0;0
pra mim o dia da mulher era dia 8 de maio shdjdk ache a burra;1;1;0;0;0;0;0;0;0;0;0;0
Quando um país não pode mais dizer quem pode e quem não pode entrar e sair, principalmente por razões de segurança _ https://t.co/SRAMKmz4dJ;1;0;0;0;0;0;0;0;0;0;1;0
@thiviecos @PastorMalafaia Voce ta lendo muito catraca livre amigo. Não vi Cristo dizendo que as crianças de 6 anos pode mudar de sexo nao;1;1;0;0;0;0;0;0;0;0;0;0
"Os ""homens"" do governo da Suécia. Sem bolas, afeminados... Não é por acaso que os ""refugiados"" deitam e rolam naque _ https://t.co/fDoIRrLlOM";1;1;0;0;0;0;0;0;0;0;1;0
Amigo, acredite, vc pode cortar seu pau fora em defesa do feminismo, que nem assim seu discurso de feministo vai te garantir uma foda hoje..;1;1;0;0;1;0;0;0;0;0;0;0
bebe cana pura e não faz careta.;0;0;0;0;0;0;0;0;0;0;0;0
"FELIZ DIA DAS MULHERES
PRA QUEM NASCEU HOMEM E ACHA QUE PRA SE MULHER BASTA COLOCAR UMA SAIA O SEU DIA É 1º DE ABRIL
#InternationalWomensDaY";1;1;0;0;0;0;0;0;0;0;0;0
@paolabuzzone por isso eu sou sapatao. super indico.;1;0;0;0;0;1;0;0;0;0;0;0
No dia da mulher, nao vi 1 palavra do movimento feminista pra defender essas mulheres do ISLÃ. Ja pra defender o co _ https://t.co/MabOl65VNC;0;0;0;0;0;0;0;0;0;0;0;0
"O que seria ""válido"", então? Feminicídio? Estupro? Mercado de trabalho? Falamos disso todo dia. Poderia dedicar uma coluna a isso, então.";0;0;0;0;0;0;0;0;0;0;0;0
a cara da gorda feia da Roberta #bbb17;1;1;1;0;0;0;0;0;0;0;0;0
@rbrochrdt dia da mulher ne cuidado com a burra;1;1;0;0;0;0;0;0;0;0;0;0
Ih olha o omi branco querendo falar pra mulher qual o papel dela https://t.co/DwUjpan0Ht;1;1;0;0;0;0;0;0;0;0;0;0
"as pessoas não entendem que no meio dos ""refugiados"" tem inúmeros terroristas, é uma coisa tão óbvia";1;0;0;0;0;0;0;0;0;0;1;0
@milanuness Bem exagerado, fui váarias vezes pra secretaria. Comecei alisar o cabelo na adolescencia, Hj queria te-los cacheados e nao posso;0;0;0;0;0;0;0;0;0;0;0;0
@PauloBotelho87 Ué, vai lá machão! Leva tua mulher pra galera ver!;1;1;0;0;0;0;0;0;0;0;0;0
Tpm é um saco, me sinto gorda e feia;1;1;1;0;0;0;0;0;0;0;0;0
Tem homem que pensa que mulher é máquina de refrigerante, que vc deposita apoio e recebe uma foda;1;1;0;0;0;0;0;0;0;0;0;0
Saber pegar sua mulher sem parecer um babaca #twittealgomuitoantigo;1;1;0;0;0;0;0;0;0;0;0;0
@Chiiaritta mas não quer dizer que quando não sabias o que eram equações trigonométricas te estavam a esconder;0;0;0;0;0;0;0;0;0;0;0;0
As sapatão tudo seguindo a Aly  https://t.co/0OMpzkP0iN;1;0;0;0;0;1;0;0;0;0;0;0
"Que mundinho pequeno esse de Sapatao ne 
a gente descola cada fita da namoradinha dos outro";1;0;0;0;0;1;0;0;0;0;0;0
"meritocracia: existe
racismo: não existe since 1888";1;0;0;1;0;0;0;0;0;0;0;0
"claro que vc pode ir pro bm júnior sarra as 9nha ein filhao 
maria tá achando que vai aonde? sair depois da 7h?? quer ser estuprada na rua?";1;1;0;0;0;0;0;0;0;0;0;0
@bbb os sem graças q vao passar a festa toda falando mal dos outros e roberta gorda feia fazendo caretas kkkkk os eliminadoa do bbb;1;1;1;0;0;0;0;0;0;0;0;0
"A esquerda reclama das coisas inventadas pela própria esquerda:
Racismo, homofobia, machismo, nazismo, cultura de estupro e luta de classes.";1;1;0;1;0;1;0;0;0;0;0;0
Kkkkkkkkkkkkkkkkkkkkkkkk que mulher burra pqp;1;1;0;0;0;0;0;0;0;0;0;0
A mulher mais burra do brasil;1;1;0;0;0;0;0;0;0;0;0;0
RT @gabrielasoligo: Hj é mulher maravilhosa, mulher é isso e aquilo..amanhã é pq mulher é tudo burra, N pode dirigir, lugar de mulher é no _;1;1;0;0;0;0;0;0;0;0;0;0
@gui_toscano Eu quero socar o cara que chamou a mulher de burra;1;1;0;0;0;0;0;0;0;0;0;0
Homem que é homem não assiste a fazenda.;1;1;0;0;0;0;0;0;0;0;0;0
RT @GiocondaBrasil: Vou para a cozinha finalizar o jantar para meu marido e filhos. Feliz dia das Mulheres pra vocês também.;1;1;0;0;0;0;0;0;0;0;0;0
"teresa: quero ir ao quintal
toda a gente excepto eu: *ignores*
teresa: é um sitio de fufas
toda a gente: BORA!1!!!!";1;0;0;0;0;1;0;0;0;0;0;0
@ana_lethicia Aff, que tutorial não é tédio??? ^VÊ um de edição de vídeo que vc entra numa facul de maquiagem;0;0;0;0;0;0;0;0;0;0;0;0
@kailatsm  me segurei pra não chorar na parte do vídeo e quando ele tava falando da Angola;0;0;0;0;0;0;0;0;0;0;0;0
Ouvi, numa rede de tv, que a Hungria, está fazendo uma cerca eletrica, para evitar invasoes de refugiados. Mas nao deu Ibope...Pesquisem sob;1;0;0;0;0;0;0;0;0;0;1;0
@ibrags @navarro_spfc obviamente anti refugiados. Obviamente nao tenho como checar os fatos, mas de um google e ache uma fonte confiavel;1;0;0;0;0;0;0;0;0;0;1;0
RT @taiannerr: Tem mulher q é burra pqp;1;1;0;0;0;0;0;0;0;0;0;0
@AlemaoTheo Tb não entendo.. Concordo com vc.,;0;0;0;0;0;0;0;0;0;0;0;0
"""Trump diz que refugiados devem voltar a seus países. Por que essa não é uma opção"" https://t.co/DkLthrpsvZ #informações #feedly";1;0;0;0;0;0;0;0;0;0;1;0
RT @quencassandra: fala da tua squad —_ um bando de fufas muito queridas <333 https://t.co/rA9YQ35HtJ;1;0;0;0;0;1;0;0;0;0;0;0
Fds eus eu que hj é dia da mulher mas tas-te a fzr de burra como é que foi outra pessoas a escrever o teu título do _ https://t.co/3amPtQETk7;1;1;0;0;0;0;0;0;0;0;0;0
Se você assistir Titanic ao contrário, verá a história de um submarino que resgata as pessoas do mar e as coloca em uma festa.;0;0;0;0;0;0;0;0;0;0;0;0
RT @CapitalismoOP: #SerMulherÉ ter cromossomos xx e não ter uma rola no meio das pernas;1;1;0;0;0;0;0;0;0;0;0;0
vou começar a andar de burca ai essas coisas não acontecem, ou sim já que homem é um ser desgraçado;1;1;0;0;0;0;0;0;0;0;0;0
"""Vai também ser lançado um manual de boas maneiras para lidar com fufas, gays e transsexuais, os chamados LGTB"" - notícias matinais na rádio";1;1;0;0;0;1;0;0;0;0;0;0
na moral mulher guando e burra não tem jeito;1;1;0;0;0;0;0;0;0;0;0;0
@FabisMorelli miga nao tem livro de estudos em promoçao , mulher é burra;1;1;0;0;0;0;0;0;0;0;0;0
RT @prrttyhrts: Me sinto sempre a amiga mais feia e gorda do grupo, sou péssima de corpo e rosto. #amproblems #askanamia;1;1;1;0;0;0;0;0;0;0;0;0
@httppocrl @nevermindbfh vocês são fufas fofas EHHEHEHE;1;0;0;0;0;1;0;0;0;0;0;0
Oi, vc é sapatão, só n sabe ainda.. mas é;1;0;0;0;0;1;0;0;0;0;0;0
@drunksadlou @girlslkgirls Meu Deus, lá é o próprio vale das sapatão;1;0;0;0;0;1;0;0;0;0;0;0
nao é pq o mito diz que mulher grávida tem que receber menos que ele é machista gente https://t.co/PQSwnv013j;1;1;0;0;0;0;0;0;0;0;0;0
"RT @bentomarcela: o terceiro foi aquele que gabriella não fez nada pq gabriella é SAPATAO
puxa o fole fi de rapariga";1;0;0;0;0;1;0;0;0;0;0;0
"Outra vez um menino pediu um lanche para uma amiga minha e ela o ignorou
o noinha gritou: vai tia, vc ja ta muito gorda!
hahahahahahahahaha";1;1;0;0;0;0;0;0;0;0;0;0
"""aparentemente sem ligações terroristas"" 
Mas não vêem que o Islão contém o ovo da serpente? Terrorista ou não, de _ https://t.co/RvGp9Y7MJu";1;0;0;0;0;0;0;1;0;0;0;0
Saudades exército de fufas revoltadas com esta sociedade machista e CIS a atacarem as pessoas;1;0;0;0;0;1;0;0;0;0;0;0
as fufas d lx são tão falsas q dói kkk;1;0;0;0;0;1;0;0;0;0;0;0
"A MULHER É PERFEITA: LINDA, TRABALHADORA, DÁ PAULADA NAS FEMINISTA E NÃO TEM FEICEBUK. 
ACHO QUE VOU PEDI-LÁ EM CAS _ https://t.co/7BEgP3dEdP";1;1;0;0;1;0;0;0;0;0;0;0
A internet é nossa! As Feministas/e cia infiltradas nos órgãos da Justiça buscam combater essa crescente por meio da censura via justiça.;0;0;0;0;0;0;0;0;0;0;0;0
"""trabalhando graças ao feminismo""
RH decide:
- vou escolher a mulher pq mesmo ela nao concluindo a faculdade, ela cagou na foto do bolsonaro";1;1;0;0;1;0;0;0;0;0;0;0
da educação que eu recebi em casa, homem foi feito pra mulher e vice verso...o resto é modinha !;1;0;0;0;0;1;0;0;0;0;0;0
"""vc tá feia, gorda, ninguém vai gostar de vc assim"" https://t.co/AepW67xnKF";1;1;1;0;0;0;0;0;0;0;0;0
"Tem ""homem"" q repara unha de mulher! Com certeza gostam de vara";1;1;0;0;0;0;0;0;0;0;0;0
O maior prazer de uma mulher inteligente, é fazer-se de burra perante um burro que se faz de inteligente;0;0;0;0;0;0;0;0;0;0;0;0
"com que os ""refugiados"" entrassem, automaticamente ele já não estaria cumprindo o seu maior dever que é proteger o país";1;0;0;0;0;0;0;0;0;0;1;0
"@fukiingbieber CPS JBE RPRDOB
Caralho porra sapatão 
Jabuti branco educado 
Rato paraplégico rondoniense doença oval bruto";1;0;0;0;0;1;0;0;1;0;0;0
"""mais mulheres na política!""
A maioria do eleitorado é mulher! 
Não são mais eleitas pq mulher não confia em mulher nenhuma";1;1;0;0;0;0;0;0;0;0;0;0
idiota é pensar q no dia d mulher eu aquela mulher cujo vc a chamou atráves de MSN feia gorda urubu fígado cheia de celulite acreditar em vc;1;1;1;0;0;0;0;0;0;0;0;0
Homem que é homem arrota com suco de laranja.;1;1;0;0;0;0;0;0;0;0;0;0
"""A maior ambição da mulher é despertar o amor."" #MulherDeVerdade";1;1;0;0;0;0;0;0;0;0;0;0
Chamem-me burra , eu n sabia q era dia da mulher até mo desejarem;1;1;0;0;0;0;0;0;0;0;0;0
vamo ser negro mas nao vamo abusar ne;1;0;0;1;0;0;0;0;0;0;0;0
Difícil pra uma mina burra e insegura que nunca conquistou nada conviver com uma mulher bonita, inteligente e independente ne? Dá pena;1;1;0;0;0;0;0;0;0;0;0;0
meu pai veio me perguntar por que mulher é tão burra pra ter filho nova (adolescentes e tal), dei minha opinião e agora ele ta brabo comigo;1;1;0;0;0;0;0;0;0;0;0;0
@Ricardohdc po ai mulher burra msm... mas se ta ligado que estagio vc n arruma ne  termina a escola daqui 3 meses;1;1;0;0;0;0;0;0;0;0;0;0
@g1 Nao esperava outra açao! A Europa sofreu muito com a Segunda Guerra Mundial e sabe que esses refugiados estao passando.;0;0;0;0;0;0;0;0;0;0;0;0
riquinha feia e gorda —_ Yha ando aqui a rebolar para a vida  https://t.co/VFxQ9xq4JK;1;1;1;0;0;0;0;0;0;0;0;0
@Crl_Lais  sapatão linda, mt maneira;1;0;0;0;0;1;0;0;0;0;0;0
Você não estará sendo machista se for uma mulher e bater em uma feminista https://t.co/jzavkOawBL;1;1;0;0;1;0;0;0;0;0;0;0
Mulher é um parque de diversões. A começar pelo humor: uma montanha-russa.;1;1;0;0;0;0;0;0;0;0;0;0
"RT @alex_borges: Feminismo 2017:
1. Homens ocidentais, usem saia e batom!
2. Abram as fronteiras para os muçulmanos!
Ligue os pontos";0;0;0;0;0;0;0;0;0;0;0;0
PARABENS SAPATÃO SDDS @attomiter https://t.co/hNz7wYc1WC;1;0;0;0;0;1;0;0;0;0;0;0
"o video era um sapatao tocando siririca
https://t.co/b824kaMh0A";1;0;0;0;0;1;0;0;0;0;0;0
eu sou a mulher mais burra do brasil;1;1;0;0;0;0;0;0;0;0;0;0
@ok__diego acordei sapatão hj;1;0;0;0;0;1;0;0;0;0;0;0
como diz o ditado: vira homem;1;1;0;0;0;0;0;0;0;0;0;0
tá pra nascer mulher burra como eu to sem celular pq esqueci o cabo do computador no estágio;1;1;0;0;0;0;0;0;0;0;0;0
@_NandaSilva_ bom dia sapatao da minha vida;1;0;0;0;0;1;0;0;0;0;0;0
"RT @meduarda_siilva: Pode ser gorda
Pode ser feia 
Só não pode ser gorda e feia 
#vemegea";1;1;1;0;0;0;0;0;0;0;0;0
MULHER GOSTA DE HOMEM PORCO QUE FEDE ARROTA E TEM TERRA DEIBAIXO DAS UNHA #JOAQUINRESPONDE https://t.co/diQ51clUMa;1;1;0;0;0;0;0;0;0;0;0;0
@homemdeverdade pega forte na cintura da sua fêmea, essa coisa de delicadeza nessas horas é desses Jonnys Manés Citricos bunda mole!;1;1;0;0;0;0;0;0;0;0;0;0
@homemdeverdade não pode ser vegetariano, a gente esta sempre no topo da cadeia alimentar !;1;0;0;0;0;0;0;0;0;1;0;0
"@gbila19 @satsld 
Que vc é gorda kkk
Luana 
Não 
Não
A verdadeira bet a feia 
Não
10/10";1;1;1;0;0;0;0;0;0;0;0;0
"Eu sou mt burra, o menino falou ""feliz dia da mulher"" ai eu ""pra você também"", nem percebi";1;1;0;0;0;0;0;0;0;0;0;0
"RT @JhullyMelo79: [9/3 09:11] jhu : Bom viado mais lindo
[9/3 09:11] Dj Luizinho: Bom dia sapatão mais gostoza ";1;0;0;0;0;1;0;0;0;0;0;0
sou um ser homossexual que só quer se dar com heteros porque as fufas ficam a lamber os dedos cheio de batata na minha frente.;1;0;0;0;0;1;0;0;0;0;0;0
a sapatão mais linda do mundo vai me dar um livro hoje rs;1;0;0;0;0;1;0;0;0;0;0;0
POR QUE SÓ TEM GLOBELEZA MULATA ISSO SIM É PRECONCEITO BRANCA NÃO SABE SAMBAR NÃO É ISSO ?????????????;1;0;0;1;0;0;0;0;0;0;0;0
"já falei que não sou racista porra
mas...";1;0;0;1;0;0;0;0;0;0;0;0
Es a favor da vinda dos refugiados? —_ Por um lado sim por outro não https://t.co/NkBUplCeDI;1;0;0;0;0;0;0;0;0;0;1;0
Já sou fã dessa mulher que cozinha na telha #MasterchefBR;0;0;0;0;0;0;0;0;0;0;0;0
Eu to passada com o quanto de cara que acha que mulher tem obrigação de conversar com ele no tinder se deu um like. Ou ele chama de puta.;1;1;0;0;0;0;0;0;0;0;0;0
@dieaug Não tinha espaço para palavra vazamentos. Contamos com a compreensão dos leitores ao usar a palavra furos. Agradecemos de vdd a msg!;0;0;0;0;0;0;0;0;0;0;0;0
Até às fufas que dizem ser homens pq gostam do mesmo que eles SÃO MULHERES E MERECEM NA MESMA UM FELIZ dia ;1;1;0;0;0;1;0;0;0;0;0;0
"RT @whoztyles: 30- Ana Carolina, 42 Anos.
rainha das sapatão, uma voz é uma voz, uma coisa linda dessas https://t.co/CqaiHAxnEs";1;0;0;0;0;1;0;0;0;0;0;0
"ALÔ FEMINISTA:
ATÉ A PORTELA VOLTOU
E O SEU PAI NADA";1;1;0;0;1;0;0;0;0;0;0;0
chamem as feministas p fazer uma manifestação pq n tem nenhuma mulher trabalhando na obra aq do lado isso é um absurdo #direitosiguais;1;1;0;0;0;0;0;0;0;0;0;0
"@Estadao Duvido o feminismo ser contra o que esse MACHO HOMEM pede aí!
O feminismo é capacho da esquerda!";1;1;0;0;0;0;0;0;0;0;0;0
PAI DA FEMINISTA SAIU PRA COMPRAR CIGARRO NO 2º GOL DO ZIDANE EM 1.998 E NUNCA MAIS VOLTOU  #JoaquinResponde https://t.co/EzreOGNSJa;1;1;0;0;1;0;0;0;0;0;0;0
Que raiva daquela mulher burra, deu os pontos igual a cara dela;1;1;0;0;0;0;0;0;0;0;0;0
nao tem como a anavitoria morena nao ser sapatao GENTE;1;0;0;0;0;1;0;0;0;0;0;0
@Yasmim_Ramaldes Tô esperando a sapatão fazer;1;0;0;0;0;1;0;0;0;0;0;0
@gosteitha não se vira sapatão, apenas se descobre aksjakajhs;1;0;0;0;0;1;0;0;0;0;0;0
"""Quem não conheça as fufas que as compre"" foi a melhor frase que disse hoje, fds";1;0;0;0;0;1;0;0;0;0;0;0
RT @TonhoDrinks: A mulher virou a principal massa de manobra globalista. Nunca foram tão usadas. Culpa de muita propaganda e prepotência.;1;1;0;0;0;0;0;0;0;0;0;0
As últimas 30 fotos da minha galeria devem ser prints disto paras as #Fufas juro AHAHAH;1;0;0;0;0;1;0;0;0;0;0;0
RT @arqmonicamendes: Acorda mulher burra: feminismo não é afrontar nudez, mas respeitar seu corpo quando o homem só quer usar você e, depoi _;1;1;0;0;0;0;0;0;0;0;0;0
Deus ta vendo vcs acordando cedo só pra torcer pra casal de sapatão burras #vipdirecto;1;0;0;0;0;1;0;0;0;0;0;0
RT @girlslkgirls: mulher é tão bom que se na próxima vida eu nascer mulher de novo com certeza vou ser sapatão mais uma vez sem pensar duas _;1;1;0;0;0;1;0;0;0;0;0;0
RT @thatdiogo: é por isto q adoro fufas  https://t.co/BdGYXdnW10;1;0;0;0;0;1;0;0;0;0;0;0
@Nai_oli88 o que eu conheço de sapatão racista.....;1;0;0;0;0;1;0;0;0;0;0;0
Os países mais solidários são os mais pobres, mais abertos aos refugiados. A Europa se fecha. O Velho Mundo não é mais o mesmo...;1;0;0;0;0;0;0;0;0;0;1;0
@Homemdeverdade não usa capa de chuva,  @Homemdeverdade nada em tsunami !;1;1;0;0;0;0;0;0;0;0;0;0
porra, agora só semana que vem o celular.. mulher burra do carai;1;1;0;0;0;0;0;0;0;0;0;0
@5gu @caiquepala AAAA, gorda do caralho.;1;1;1;0;0;0;0;0;0;0;0;0
confirmado 100% que aquela @ que eu falei é sapatao;1;0;0;0;0;1;0;0;0;0;0;0
Feliz dia da: Gorda, da feia, da magrela, da bruxa, da velha, da frágil, da empregada...;1;1;1;0;0;0;0;0;0;0;0;0
"Se vc tem um namorado que diz que não olha para as gostosas e que
não bate umazinha nunca! FUJA: é uma franguinha sem caráter !!!";1;1;0;0;0;0;0;0;0;0;0;0
RT @olhosvioleta_: Feliz dia das mulheres para todas as minhas seguidoras lindas e maravilhosas!  meu twitter parece um jardim: só tem flo _;1;1;0;0;0;0;0;0;0;0;0;0
"Um novo dia é uma página em branco na sua vida. Escreva apenas o que vale a pena. 
Bom dia!";0;0;0;0;0;0;0;0;0;0;0;0
"+q julga a amiguinha d burra so pq ela se arruma e n segue o esteriotipo, q axa q tem ""mulher q preste x mulher q n presta"" etc etc PAREM";1;1;0;0;0;0;0;0;0;0;0;0
@5gu @caiquepala Tinha que ser gorda, né?;1;1;1;0;0;0;0;0;0;0;0;0
Quando você tem dúvida se hj vai sair de sapatao trevosa ou hetero mocinha @milla_canazar @brendadsbf https://t.co/ExyLcXoCjX;1;0;0;0;0;1;0;0;0;0;0;0
gorda e feia;1;1;1;0;0;0;0;0;0;0;0;0
@AdemirAlvim eu tenho conhecimento dessa doutrinação nas escolas... Uma triste realidade no Brasil e no mundo!;0;0;0;0;0;0;0;0;0;0;0;0
@joanaccbarbosa @t4keshy sim mas n gosto de fufas.;1;0;0;0;0;1;0;0;0;0;0;0
nao deu pra carregar meu passe pq a mulher do setuf eh uma burra;1;1;0;0;0;0;0;0;0;0;0;0
União Europeia quer multar países que não abrigarem refugiados. Entendem agora porque tudo isso vai ruir?#Europaxit;1;0;0;0;0;0;0;0;0;0;1;0
"Fico imaginando se o @omelete realmente acha que se mulheres negras q não ""chegaram lá"" por sofrerem racismo são ""vitimistas"".";1;1;0;1;0;0;0;0;0;0;0;0
RT @_Renzzi: Mulher burra me da nojo!;1;1;0;0;0;0;0;0;0;0;0;0
RT @teresa9teixeira: As últimas 30 fotos da minha galeria devem ser prints disto paras as #Fufas juro AHAHAH;1;0;0;0;0;1;0;0;0;0;0;0
Como se ser gorda te faz ser feia, teu cu;1;1;1;0;0;0;0;0;0;0;0;0
é tanta caloura sapatão que vai ter apresentações de voz e violão na cantina durante os intervalos;1;0;0;0;0;1;0;0;0;0;0;0
"RT @PanichiRaphael: Lembrem-se FemiNazis:
No Oriente Médio e no mundo muçulmano onde reina a Sharia não houve dia internacional da Mulher _";1;1;0;0;1;0;0;0;0;0;0;0
"""Oi, nós somos sapatão"" KKKKKKKKKKKKKKKKKK";1;0;0;0;0;1;0;0;0;0;0;0
RT @CusquicesFufas: Fufas trocam alma por pão fofo !;1;0;0;0;0;1;0;0;0;0;0;0
RT @ezvenus_: Incrível a facilidade que sapatao tem pra namorar;1;0;0;0;0;1;0;0;0;0;0;0
as fufas celebram o dia da mulher?;1;0;0;0;0;1;0;0;0;0;0;0
esse filha da puta do donald trump diminui a quantidade de refugiados que podem entrar no país, pq nao e a familia dele que ta sofrendo la;1;0;0;0;0;0;0;0;0;0;1;0
Ai vc chega no colegio super cansada do trabalho e curso e encontra o grupinho das sapatao falando de ex. Se uma coisa que sapatao tem é ex.;1;0;0;0;0;1;0;0;0;0;0;0
RT @spitittout: Desde qnd é que um preto pode ter mais dinheiro que um branco, sem sentido https://t.co/HyTvpa1xcG;1;0;0;1;0;0;0;0;0;0;0;0
"""Há homens que têm patroa.
Há homens que têm mulher.
E há mulheres que escolhem o que querem ser."" #MulherDeVerdade";1;1;0;0;0;0;0;0;0;0;0;0
@RaquelRangel0 menina se não fosse o movimento feminista nem existiria o dia da mulher deixa de ser burra;1;1;0;0;0;0;0;0;0;0;0;0
@pj_igor os negros não vão gostar.;1;0;0;1;0;0;0;0;0;0;0;0
"Quanto amor meu deus  
09/03/17 10:12:01: Sapatao : Fala amor da minha vida. Meu coração fora do corpo";1;0;0;0;0;1;0;0;0;0;0;0
Porra, sou muito burra... Sempre esqueço coisas que nenhuma mulher esqueceria;1;1;0;0;0;0;0;0;0;0;0;0
@jotap_rios samba é cultura negra. independente se o negro não saiba sambar. brancos podem sambar, mas não podem representar o samba.;1;0;0;1;0;0;0;0;0;0;0;0
"RT @solwdive: usa termos como ""mariquice"" e relacionar isso com o ""Islão invasor"" e ainda se pergunta porque não dão tempo de antena ao seu _";1;0;0;0;0;1;0;1;0;0;0;0
@mariaa_msj não quero, assim eu seria a feia e gorda do casal;1;1;1;0;0;0;0;0;0;0;0;0
