text;Hate.speech;Sexism;Body;Racism;Ideology;Homophobia;Origin;Religion;Health;OtherLifestyle;Migrants;Ageing
"@Mawara @elmalditocabron Não. Tem que começar a se opor ao islã de verdade, inclusive ser contra ""refugiados"" no ocidente.";1;0;0;0;0;0;0;0;0;0;1;0
@gabrisinhas @LeoLimaDuarte racismo inverso é mimimi de branco. deus é uma palavra que existe, mas deus não existe miga;1;0;0;1;0;0;0;0;0;0;0;0
"Felipe Neto era foda em meados de 2009/2010/2011, mandava bem no humor negro!
Virou um personagem bicha pra ganhar money da gayzada";1;0;0;0;0;1;0;0;0;0;0;0
A outra lá fica de cara feia. Aí se abre toda com a droga do sertanejo. Mulher burra, viu? #bbb17;1;1;0;0;0;0;0;0;0;0;0;0
Isso aqui a @SpOAB não vê. Mas piadinhas que o @editorahumanas faz de gorda feminista eles se preocupam... https://t.co/sAqVlHh3fo;1;1;1;0;1;0;0;0;0;0;0;0
RT @feministinho: Hoje vi uma mulher se afogando no clube. Fiquei apenas de longe incentivando-a para não roubar seu protagonismo. O velóri _;1;1;0;0;0;0;0;0;0;0;0;0
Hoje é o dia da mulher e eu realmente tô de parabéns viu!!!!! PQ EU ACABEI DE FAZER A MAIOR MERDA Q EU PODERIA TER FEITO!!! Que menina burra;1;1;0;0;0;0;0;0;0;0;0;0
Nosso livro tá com um mega desconto na @amazon! Sai só por R$ 17,94! https://t.co/4XWtzrIYYx via @amazon;0;0;0;0;0;0;0;0;0;0;0;0
RT @Egocentricpapi: Mulher inteligente é outro mambo ya, não tem como! Burra não, pode ser bue bonita mas burra ta gato, pode morrer..;1;1;0;0;0;0;0;0;0;0;0;0
FAKE NEWS! Toda a gente sabe que só os brancos praticam a escravatura e que o Islão é a religião da paz. Só propaga _ https://t.co/0Z0o0cFRk6;0;0;0;0;0;0;0;0;0;0;0;0
Sapatao nao deveria sentir cólica, muito menos menstruar ;1;0;0;0;0;1;0;0;0;0;0;0
a vantagem de namorar uma mendiga é que na hora de levar embora pra casa vc pode deixá-la em qualquer lugar;1;1;0;0;0;0;0;0;0;1;0;0
RT @prylliimaa: @cicibranco @UOLNoticias @UOL burra pq não concordo com vcs? Pensei q a mulher fosse livre. Ah, é...A liberdade acaba quand _;1;1;0;0;0;0;0;0;0;0;0;0
"as fufas usam sempre o msm argumento
""como mais cona que tu""";1;0;0;0;0;1;0;0;0;0;0;0
"EU TENHO PENA DAS MULHERES COM ESSE HOMENS DE HOJE
ACHO QUE EU VIRARIA SAPATÃO, OLHA DÁ VERGONHA DA MINHA RAÇA _ https://t.co/z4wRncC98n";1;1;0;0;0;0;0;0;0;0;0;0
RT @gaviaochis: Golpe do Troco, bem na hora que o meliante pega o troco, esconde uma nota no meio da carteira e diz para a atendente que o _;0;0;0;0;0;0;0;0;0;0;0;0
@Mih_ArmstrongL @otmar03 defeitos do movimento feminista -> apoioar o aborto, drogas, escola sem partido, marcha das vadias, agenda esquerda;0;0;0;0;0;0;0;0;0;0;0;0
RT @New_Delia: E os países acolhendo refugiados. Tem que gastar dinheiro ajudando essa gente lá no seu país. Infelizmente essa gente não dá _;1;0;0;0;0;0;0;0;0;0;1;0
@catracalivre Feminismo: movimento de cooptação de mulheres p/ a militância esquerdista, não defende mulheres. O Bo _ https://t.co/2AL5dbOqm1;0;0;0;0;0;0;0;0;0;0;0;0
"@ptana_ @anajuliacostaf1 gorda feia 
xodade";1;1;1;0;0;0;0;0;0;0;0;0
hoje a mulher é linda é amor  etc etc... amanha a mulher é vagabunda puta e burra;1;1;0;0;0;0;0;0;0;0;0;0
sapatão trovando igual homem https://t.co/dELjHkpPhx;1;0;0;0;0;1;0;0;0;0;0;0
fala da tua squad —_ um bando de fufas muito queridas <333 https://t.co/rA9YQ35HtJ;1;0;0;0;0;1;0;0;0;0;0;0
@guiwde @JosyTelles_REAL Acolher refugiados loirinhos não tá na moda, não dá ibope pra ninguém. Mas se forem LGBT...;1;0;0;0;0;0;0;0;0;0;1;0
a mina é tão gorda quem nem a indireta que mandei pra ela serviu;1;1;1;0;0;0;0;0;0;0;0;0
É mta falta de uma louça, de umas roupas pra passar, de um chão de banheiro pra esfregar um pano https://t.co/VTif2nyuNo;1;1;0;0;0;0;0;0;0;0;0;0
pensava q essa cena de n se sentirem minimamente atraídas por raparigas mas no entanto quererem entrar no mundo das fufas já n era moda;1;0;0;0;0;1;0;0;0;0;0;0
RT @igald_: gente sigam o @direitafalando ele mostra a realidade tenebrosa do marxismo cultural comunista feminista socialista q o PT quer _;0;0;0;0;0;0;0;0;0;0;0;0
Falou a q chama as pessoas de burra só pq ela não quer ficar em casa fazendo seu papel de mulher: LAVAR LOUÇA https://t.co/dGba7kK2oy;1;1;0;0;0;0;0;0;0;0;0;0
Essa hora é qdo a mulher quer sair da balada pra ir pra casa pra levar vara;1;1;0;0;0;0;0;0;0;0;0;0
"passou umas mulheres do meu lado e ficaram cochichando ""é sapatão""";1;0;0;0;0;1;0;0;0;0;0;0
Raiane sapatão fld dá mh bunda KKKKKKKKK;1;0;0;0;0;1;0;0;0;0;0;0
Mas não há muito o que Berlim possa fazer para responder ao insulto. A Alemanha depende de Erdogan para frear o fluxo de refugiados.;0;0;0;0;0;0;0;0;0;0;0;0
"""La La Land"" mais parece titulo de um doc. sobre a terra dos larilas e das fufas.. O mundo esta perdido.";1;0;0;0;0;1;0;0;0;0;0;0
"Acabei de ouvir uma cigana dizer q ""os chineses são um povo sujo e sem higiene q vive e dorme em qualquer lado"".
O cliché morreu hj às 16h09";1;0;0;1;0;0;1;0;0;0;0;0
"feliz dia do ""eu to gorda, feia e inchada"" feliz dia da TPM meninas ";1;1;1;0;0;0;0;0;0;0;0;0
"o pior de tudo que é uma MULHER defendendo um filho da puta que assume ser abusivo E ELA DEFENDE O CARA
MIGA PARA VC TA SENDO BURRA";1;1;0;0;0;0;0;0;0;0;0;0
"""Uma mulher nua seria menos perigosa q é uma saia habilmente exibida, q cobre tudo e, ao mesmo tempo, deixa tudo à vista."" #MulherDeVerdade";1;1;0;0;0;0;0;0;0;0;0;0
Hj é mulher maravilhosa, mulher é isso e aquilo..amanhã é pq mulher é tudo burra, N pode dirigir, lugar de mulher é no fogão..hipócritas flw;1;1;0;0;0;0;0;0;0;0;0;0
RT @thais_inha: #EuParo pq há disparidade salarial, dificuldade de reinserção no mercado, discriminação por ter filhos/estar grávida e dupl _;1;1;0;0;0;0;0;0;0;0;0;0
jr q ñ th paciência p dramas d fufas;1;0;0;0;0;1;0;0;0;0;0;0
RT @JhullyMelo79: gnt, eu n sou sapatao , esse viado q me chama assim kkk;1;0;0;0;0;1;0;0;0;0;0;0
Chamaram a Gattaz de sapatão na arena jeuanuaneuaheuhasesse e o Glinhas de viado em Minas. Hum, Vamos militar?;1;0;0;0;0;1;0;0;0;0;0;0
Tem tanta sapatão bonita em SP que da ate vontade de ficar por aqui mesmo;1;0;0;0;0;1;0;0;0;0;0;0
Aaaaaa Turma de 9 homens e eu, o prof fala de cabo sapatão (conector femea femea) e todo mundo olha pra mim;1;0;0;0;0;1;0;0;0;0;0;0
homem que é homem arrota com suco de laranja, no ouvido da namorada.;1;1;0;0;0;0;0;0;0;0;0;0
Uma #MulherDeVerdade não é adepta a joguinhos infantis. É sincera, fala o que pensa e o que sente.;1;1;0;0;0;0;0;0;0;0;0;0
@HelderRocha16 @ChagaLuccas caso de um não, eu vejo na tv tb como os gays morrem.. por puro ciume do companheiro..;1;0;0;0;0;1;0;0;0;0;0;0
"SÓ LEMBRANDO, HOJE 08 DE MARÇO É #DiaDaMulher 
M - U - L - H - E - R
PRA HOMEM QUE USA SAIA, MAQUIAGEM ETC:
SEU DIA É O 1º DE ABRIL.
#PAZ";1;1;0;0;0;0;0;0;0;0;0;0
Acho muito legal as feministas que compartilham coisa do quebrando o tabu e chamam as outras de gorda, feia e briga por macho, parabéns p vc;1;1;1;0;0;0;0;0;0;0;0;0
"#SerMulherÉ TER (OU JÁ TER POSSUÍDO) ÚTERO, OVÁRIO, TROMPAS DE FALÓPIO ETC 
RESTO É GAMBIARRA
#InternationalWomensDay FELIZ DIA DAS MULHERES";1;1;0;0;0;0;0;0;0;0;0;0
"Comentou com ""ata"" , já sei que é feminista muxibenta...
AHH, VÃO LAVAR A LOUÇA SUAS MAL AMADAS!!!!";1;1;0;0;1;0;0;0;0;0;0;0
@jujucardoso10 típicas frases das gajas, pq hj e o dia da mulher! burra!!!!!!;1;1;0;0;0;0;0;0;0;0;0;0
@Jgdm1965 não fosse o Benfica e ainda teria os dentes desalinhados...;0;0;0;0;0;0;0;0;0;0;0;0
"Terrorista marroquino recebia apoio financeiro do Estado e viveu num centro social 
https://t.co/Vpev4geiiS";0;0;0;0;0;0;0;0;0;0;0;0
RT @andrefran: Banir refugiados não é apenas cruel mas prejudicial economicamente. https://t.co/nviGRfgCjN;0;0;0;0;0;0;0;0;0;0;0;0
Q mulher estúpida! https://t.co/31IFZgfzxR;1;1;0;0;0;0;0;0;0;0;0;0
"RT @annyxv: O #diadamulher não é uma ""data comemorativa"". É um dia para conscientização da luta diária das mulheres em busca de respeito e _";0;0;0;0;0;0;0;0;0;0;0;0
@beckttx @spacelerman ELA EH SAPATAO EH LARISSA JOGA IDEIA VAI Q ELA SE ENCANTA;1;0;0;0;0;1;0;0;0;0;0;0
MDS essa mulher que atende aqui é muito burra cara;1;1;0;0;0;0;0;0;0;0;0;0
"RT @alcoolinda: teresa: quero ir ao quintal
toda a gente excepto eu: *ignores*
teresa: é um sitio de fufas
toda a gente: BORA!1!!!!";1;0;0;0;0;1;0;0;0;0;0;0
RT @naominfeliz: eu ainda não superei o clipe de baiana e esse casal sapatão afrocentrado  https://t.co/EROEk1lBZ6;1;0;0;0;0;1;0;0;0;0;0;0
RT @lionnisterz: AS SAPATÃO TÃO NERVOSAZ https://t.co/utM5uaa14Y;1;0;0;0;0;1;0;0;0;0;0;0
"Matérias que deveriam ser obrigatórias (meninas)
- PORT/MATEM
- Não seja uma vadia mentirosa
- Romantismo: merda
- Seja chupeteira";1;1;0;0;0;0;0;0;0;0;0;0
RT @juandddrade: 7 eu to CAGANDO pras pessoas que me chamam de gorda, magra, alta, baixa, feia, etc, são só opiniões e a minha é a que vale;1;1;0;0;0;0;0;0;0;0;0;0
"Sapatão fala ""AAAAAAAAAA"" de alegria, de aleluia kkkkkkkk https://t.co/Wgr9drJ2YK";1;0;0;0;0;1;0;0;0;0;0;0
"Estes 2 golos e as respetivas jogadas são mais uma prova de que o Benfica está a ser claramente levado ao colo na Taça da Liga
#VERGONHA";0;0;0;0;0;0;0;0;0;0;0;0
"Ver 1 mulher com 1 olho negro é das coisas que mais me revolta.
Nunca sei se é 1 ex do Carrilho ou 1 gótica a passar dificuldades económicas";0;0;0;0;0;0;0;0;0;0;0;0
@lipesff @Johnnschubert VERDADE! Ele sempre foi gatinho, mas eu era sapatão demais para prestar atenção hahahah;1;0;0;0;0;1;0;0;0;0;0;0
TÃO LAMENTÁVEL QUANDO SUA PHOTO SÉLFI NA ACADEMIA EVIDENCIANDO A MUSCULATURA VAI CRIAR VERGONHA RAPAZ _ https://t.co/DAscgN4SQb;1;1;0;0;0;0;0;0;0;0;0;0
RT @ly_carr: Toda vez que vejo homem comentando que toda feminista é sapatão tenho vontade de gritar no ouvido dele QUEM DERA;1;1;0;0;1;1;0;0;0;0;0;0
Homem que é homem não nota o esmalte das mulheres;1;1;0;0;0;0;0;0;0;0;0;0
RT @barata2001: @bento__9 @aloaloads isso e racismo pos anoes pretos fufas gays e shemales simao;1;0;0;0;0;1;0;0;0;0;0;0
"Mulher sofre na balada?
Se uma gorda feia quiser pegar o cara, ou ele pega e fica c/ fama de barangueiro ou não pega e fica c/ fama de viado";1;1;1;0;0;0;0;0;0;0;0;0
Ontem fui ver o Benfica. Foi uma grande noite, até ao momento em que tentei entrar em casa e a minha mulher decidiu imitar o Ederson...;0;0;0;0;0;0;0;0;0;0;0;0
porra q mulher burra;1;1;0;0;0;0;0;0;0;0;0;0
sai ow não sou tuas nega;1;1;0;1;0;0;0;0;0;0;0;0
@CapitalismoOP @editorahumanas vdd!! Porque eles estão pouco se importando para a segurança dá mulher!!!;1;1;0;0;0;0;0;0;0;0;0;0
@LuanDUG mulher é tudo burra  brincadeira! ;1;1;0;0;0;0;0;0;0;0;0;0
Feliz dia das mulheres @RachelSherazade, certamente a principal voz feminina na TV;0;0;0;0;0;0;0;0;0;0;0;0
Desculpa gente, mas quando vejo mulher falando mal do feminismo eu só consigo pensar que ela é muito burra ou não sabe o que é feminismo;1;1;0;0;0;0;0;0;0;0;0;0
@nyahler Uma pessoa com anorexia se considera GORDO, mas é MAGRO. voce pode se considerar o que quiser...mas biologicamente é so XX ou XY;1;1;0;0;0;0;0;0;0;0;0;0
O Henrique Raposo já terá dito que nada tem contra comunas ou fachos, pois até tem um amigo que é as duas coisas...;0;0;0;0;0;0;0;0;0;0;0;0
"@CusquicesFufas Um twitter sobre as ""fufas"" do porto. Realmente há demasiado tempo livre. Que tal varrer um chão e lavar uma loiça?";1;0;0;0;0;1;0;0;0;0;0;0
Mariel tem uma mania feia de ficar me chamando de gorda ;1;1;1;0;0;0;0;0;0;0;0;0
@laurensisart se for gorda, feia, mt magra, isso e aquilo, é DA MULHER e não de uma mulher específica cara....aiai vou nem falar mais nada;1;1;1;0;0;0;0;0;0;0;0;0
#Encontro a feminista se droga, bebê até cair e sai com um cara q conheceu há 2 min, usuário de droga, e depois quer reclamar de assedio...;1;1;0;0;1;0;0;0;0;0;0;0
RT @jpintocoelho60: A Europa, muito doente e submissa a estes espectáculos de mariquice nojenta, claro que se torna presa fácil do Islão in _;1;0;0;0;0;1;0;1;0;0;0;0
"pré adolescente?
tenho idade pra ser teu pai
só não sou pq uso camisinha https://t.co/GM9KKDoj8P";0;0;0;0;0;0;0;0;0;0;0;0
Levante-se diante do cabelo branco, honre o homem idoso e tenha temor do seu Deus. Eu sou Jeová. (Lv. 19:32);0;0;0;0;0;0;0;0;0;0;0;0
batalha no dia da mulher e eu nem lembrei burra meixmo deve ter sido top;1;1;0;0;0;0;0;0;0;0;0;0
"@wondcabeyo ninguém me quer mesmo 
Sou feia,gorda,chata";1;1;1;0;0;0;0;0;0;0;0;0
Mimimi do @jornalnacional agora é contra Marine LePen;0;0;0;0;0;0;0;0;0;0;0;0
essa gente que quer combater o racismo mas diz q por uma pessoa ser branca ela não pode fazer x coisa.....tipo se vestir de iemanjá;1;0;0;1;0;0;0;0;0;0;0;0
Tem gente tão chata e burra que nem entende porque tem um dia da mulher;1;1;0;0;0;0;0;0;0;0;0;0
RT @GABRIELPlNHEIRO: Nem todo trans é estuprador mas existem, sim Não vamos deixar as meninas com homens no banheiras sozinhas https://t.co _;1;1;0;0;0;0;0;0;0;0;0;0
eu sou gorda, meu cabelo não é bom, minha cara é bem feia;1;1;0;0;0;0;0;0;0;0;0;0
#NaoAceitamosRefugiados A Imprensa preocupa-se tanto com refugiados mas nao lembra os cristaos perseguidos e mortos no Oriente Medio;1;0;0;0;0;0;0;0;0;0;1;0
Trump diz que refugiados devem voltar a seus países. Por que essa não é uma opção https://t.co/5Rh77WFmVB;1;0;0;0;0;0;0;0;0;0;1;0
@ruandismo não, só me chama de sapatão as vezes;1;0;0;0;0;1;0;0;0;0;0;0
Meu Deus!!! Que absurdo e humilhante dizer que a mulher veio da costela de Adão!!!!!! https://t.co/8GfTzszjr9;0;0;0;0;0;0;0;0;0;0;0;0
Jeff Sessions é um homem honesto. Ele não disse nada de errado. Podia ter respondido com maior precisão, mas claram _ https://t.co/CyZ5nbTYIX;0;0;0;0;0;0;0;0;0;0;0;0
Alexandre Moraes não deveria sequer ter sido Ministro, agora ocupará uma cadeira no STF? Gsus;0;0;0;0;0;0;0;0;0;0;0;0
a solução para o racismo é PARAR DE FALAR SOBRE ELE foi o morgan freeman q disse;1;0;0;1;0;0;0;0;0;0;0;0
RT @csl_silva: Mulher burra machucou meu braço;1;1;0;0;0;0;0;0;0;0;0;0
@killercookie77 eu vejo sapatao fazendo isso e fico meu amor acho q JA CHEGA DE INTERNET POR HOJE PRA VC https://t.co/PdUGX4MB8Q;1;0;0;0;0;1;0;0;0;0;0;0
"""A mulher tem que ser o que ela quiser""
MAS NAO USA DECOTE SUA VADIA NAO PODE, TEMOS QUE ANDAR TODAS DE BURCA";1;1;0;0;0;0;0;0;0;0;0;0
Jamais confunda um homem porco a um @homemdeverdade, um @homemdeverdade sabe bem a hora de lavar as mãos !;0;0;0;0;0;0;0;0;0;0;0;0
"Feliz dia do ""essa é puta"", ""essa é vadia"" ""essa é feia"" ""essa é gorda"", huuuuum essa é gostosa. Feliz dia do... https://t.co/WhU5Qar7lg";1;1;1;0;0;0;0;0;0;0;0;0
RT @editorahumanas: Feliz dia internacional da mulher! https://t.co/zcICp6wAWp;0;0;0;0;0;0;0;0;0;0;0;0
filho nunca segurou e nunca vai segurar macho, ainda mais se for esses mlq da vida,mulher q engravida sabendo q o cara é safado,é burra sim;1;1;0;0;0;0;0;0;0;0;0;0
Só podia ser mulher pra reparar roupa https://t.co/rrFyFds3RH;1;1;0;0;0;0;0;0;0;0;0;0
"RT @carolinaamatos: ""Quem não conheça as fufas que as compre"" foi a melhor frase que disse hoje, fds";1;0;0;0;0;1;0;0;0;0;0;0
@thienques pra mulher ser digna pra elas têm q ser feia gorda fedida porca mal comida e sustentada pelos pais ou vendedora de shopping;1;1;1;0;0;0;0;0;0;0;0;0
Tu e a sardinha parecem fufas meu —_ Somos namuradas, está na cara  https://t.co/3lIZLG1vEa;1;0;0;0;0;1;0;0;0;0;0;0
ainda estou surpreendida com a cara de sapatão dessa camilinha https://t.co/yGYxHrvIl8;1;0;0;0;0;1;0;0;0;0;0;0
Minha migas do curso de dizem heteras,são casas mas são mais Sapatao do que eu;1;0;0;0;0;1;0;0;0;0;0;0
"RT @direitafalando: hj vou prestar queixa por ter sido vitima de racismo inverso
me chamaram de branco azedo";1;0;0;1;0;0;0;0;0;0;0;0
"Tô com uma vontade (bem grande) de mandar a atual dá minha ex ir se fuder!!!
*O que ela quer ficar me encarando*";0;0;0;0;0;0;0;0;0;0;0;0
mais sapatão que isso, só isso https://t.co/LadAgP8NRx;1;0;0;0;0;1;0;0;0;0;0;0
Feliz dia das mulheres do bem, de direita e que com suas vozes e seus atos fazem do Brasil um país melhor ! https://t.co/P1QNj5QUmz;0;0;0;0;0;0;0;0;0;0;0;0
Eu não me importo se a pessoa é magra gorda feia bonita se é de humanas ou exatas, se ela me tratar bem eu vou retribuir da mesma forma;0;0;0;0;0;0;0;0;0;0;0;0
"engraçado que eu percebo que qt + bonita a menina for
+ ela se acha feia/gorda
e quanto + feia
+ se acha 
pq meol deols";1;1;1;0;0;0;0;0;0;0;0;0
RT @bonisss: A cada dia que passa cresce aindamais os adeptos à Marcha do Orgulho Hétero!!! RT Pelos poucos héteros que restam!!;1;0;0;0;0;1;0;0;0;0;0;0
"Que mulher burra do cacete 
Vsf alana";1;1;0;0;0;0;0;0;0;0;0;0
"Matérias q deveriam ser obrigatórias (meninos)
- PORT/MATEM
- Geografia/Hist
- Largar de viadagem
- Seja homem
- Coma mulher direito seu FDP";1;1;0;0;0;1;0;0;0;0;0;0
"""Parabéns pra você, mulher. Parabéns pra você que é feia, gorda, não se cuida, coitada. Que não vai arranjar... https://t.co/CEoqvg3lGa";1;1;1;0;0;0;0;0;0;0;0;0
Uma #MulherDeVerdade se cuida. Quer estar linda, gostosa, apetitosa e, principalmente, inteligente. Mas, para ela mesma, em 1º lugar.;1;1;0;0;0;0;0;0;0;0;0;0
"Chega pra mina e fala:
-Por a caso seu pai é o capeta??
-Não pq???
-Pq vc é a visão do inferno.";1;1;0;0;0;0;0;0;0;0;0;0
"liechtenstein tem tudo de bom: monarquia, não aceitou os refugiados, identidade nacional e frio
https://t.co/0bmoZ15Ry9";1;0;0;0;0;0;0;0;0;0;1;0
@felipetlo @Felipebastos022 gorda e feia só se tiver bêbado;1;1;1;0;0;0;0;0;0;0;0;0
@bigsbywo SAPATÃO BABANDO EM CIMA DE MINA HETERO DESPERTA 01 ÚNICO SENTIMENTO: https://t.co/qTA5mX1to7;1;0;0;0;0;1;0;0;0;0;0;0
"#SerMulherÉ achar que por vc ser gorda está fora do ""normal"" e feia.";1;1;1;0;0;0;0;0;0;0;0;0
"""A mulher tem uma única via para superar o homem: ser mais mulher a cada dia."" #MulherDeVerdade";1;1;0;0;0;0;0;0;0;0;0;0
Magrela feia —_ Sou gorda amor https://t.co/tSU5XTen3m;1;1;1;0;0;0;0;0;0;0;0;0
O Jorge Monforte é bué burra ya, vai dizer que quer ter filhos com a mimada da Bia à mulher que é pediu para abortar? Ahahahaha burro;0;0;0;0;0;0;0;0;0;0;0;0
"RT @ALuizCosta: Prefeita de Calais, da direita ""moderada"" (partido de Fillon), proíbe dar comida a refugiados https://t.co/LlB8SA3v4n";1;0;0;0;0;0;0;0;0;0;1;0
Refugiados não passam de 0.3% da população do planeta. https://t.co/0gyeBrx7mj;0;0;0;0;0;0;0;0;0;0;0;0
"Homem que é homem não come; bebe.";1;1;0;0;0;0;0;0;0;0;0;0
Gostaria de entender pq quando a mulher é feia feat gorda vcs acham MT lindo quando ela bota sem roupa, isso aí mana se liberta, mostra mesm;1;1;1;0;0;0;0;0;0;0;0;0
"RT @perfectbody07: É muito difícil se amar depois do primeiro ""gorda"", ""feia"".
Mais difícil é se olhar no espelho sabendo que você é...
#as _";1;1;1;0;0;0;0;0;0;0;0;0
gnt, eu n sou sapatao , esse viado q me chama assim kkk;1;0;0;0;0;1;0;0;0;0;0;0
Homem de verdade que não sabe desenhar um Pinto, não conhece o pau que tem! Honre seu Pinto!!!!;1;1;0;0;0;0;0;0;0;0;0;0
"Engraçado q se uma mulher não concorda com oq a maioria acha que é ""certo"", as outras mulheres caem matando, chamando de burra, retardada...";1;1;0;0;0;0;0;0;0;0;0;0
RT @adrism16: td dia o msm post no ldrv perguntando cade as sapatao;1;0;0;0;0;1;0;0;0;0;0;0
Sim , dia da mulher —_ Ata desculpa eu sou burra  https://t.co/HSFpdccEXK;1;1;0;0;0;0;0;0;0;0;0;0
RT @girlslkgirls: sapatão raitella, tem como? tem https://t.co/cPHYOylEYz;1;0;0;0;0;1;0;0;0;0;0;0
Vim trabalhar com uma camiseta da minha namorada hoje, tô me sentindo bem sapatão ;1;0;0;0;0;1;0;0;0;0;0;0
Mulher, até a Angelina Jolie é traida e vc acha q vc não? Larga de ser otária;1;1;0;0;0;0;0;0;0;0;0;0
Todo dia eu to bem sapatao sim, mas tem dias que eu me surpreendo;1;0;0;0;0;1;0;0;0;0;0;0
 azeiteiro, quero q te fodas volta para a tua terra;0;0;0;0;0;0;0;0;0;0;0;0
#HQEH não pergunta à esposa/namorada onde ela quer ir. Fala pra onde eles vão e pronto.;1;1;0;0;0;0;0;0;0;0;0;0
Mas previdência não é coisa de quem trabalha?  https://t.co/3qZoXQqTfw;0;0;0;0;0;0;0;0;0;0;0;0
@leoovini sapatão com jogo tá quase igual hetero, o raca ein;1;0;0;0;0;1;0;0;0;0;0;0
só nao pode ser gorda e feia;1;1;1;0;0;0;0;0;0;0;0;0
"RT @imjustkiff: as fufas usam sempre o msm argumento
""como mais cona que tu""";1;0;0;0;0;1;0;0;0;0;0;0
A situação da Europa resumida: Aceitar refugiados e lidar com risco de terroristas infiltrados ou não aceitar e ser taxado de xenofóbico.;1;0;0;0;0;0;0;0;0;0;1;0
Não acho burra a mulher que prefere se separar do que viver de mentiras, otária é quem gosta de ser corna e se fazer de feliz.. ;1;1;0;0;0;0;0;0;0;0;0;0
@amora_inlove Puts, complicado... Mas, ele respeita tuas sensações? Se sim, ótimo. Tem que ver então como ele encara isso.. Seicomoé;0;0;0;0;0;0;0;0;0;0;0;0
"Nem eu tô me reconhecendo mais !
Eita mulher burra";1;1;0;0;0;0;0;0;0;0;0;0
Vcs fufas são bue abusadas;1;0;0;0;0;1;0;0;0;0;0;0
"Eu não mereço ser estuprada no banheiro feminino por uma mulher trans lésbica! 
NÃO a ideologia de gênero";1;1;0;0;0;0;0;0;0;0;0;0
O pior cego é aquele que não quer enxergar, tenho ranço de mulher burra !;1;1;0;0;0;0;0;0;0;0;0;0
"qual o problema em dizer que mulher é mulher e homem é homem...porque tanta histeria ?
pessoal da agenda gay so pod _ https://t.co/uYcKe0GH70";1;1;0;0;0;0;0;0;0;0;0;0
@CapitalismoOP tem travesti que parece mais com mulher do que as feministas... pq as feministas parecem macho mal acabados...;1;1;0;0;1;0;0;0;0;0;0;0
RT @LeNaZZo: Um @homemdeverdade eh akele q sabe procriar sem deixar vestigios.;1;1;0;0;0;0;0;0;0;0;0;0
@Vivianimonfrad1  ela tem a carinha bonitinha porque é magrinha  fosse uma feia gorda o povo já tinha escutado ela né mas como é bonitinha;1;1;1;0;0;0;0;0;0;0;0;0
"@GloboNews ""Bandido tem que se fuder e acabou!!""";1;0;0;0;0;0;0;0;0;1;0;0
RT @margaridtavares: Vcs fufas são bue abusadas;1;0;0;0;0;1;0;0;0;0;0;0
eu nao sou homofóbico, mas...........;1;0;0;0;0;1;0;0;0;0;0;0
@ajulysantos nao esqueça que ele quer receber refugiados de guerra, vai islamizar o brasil;1;0;0;0;0;0;0;0;0;0;1;0
@anapaularsstt sapatao tinha q ser né, meu sonho bjar a callie, agora sou arizona já posso realizá-lo;1;0;0;0;0;1;0;0;0;0;0;0
@ofuxico_oficial ESSA mulher pq quem transa com um cara como esse vadia de burra essa garota escrota nao tem nada .;1;1;0;0;0;0;0;0;0;0;0;0
@coebravo foda se ela to nem ai, gorda feia idiota;1;1;1;0;0;0;0;0;0;0;0;0
Feliz dia das mulheres pra você que se depila e não faz textão no Facebook!;1;1;0;0;1;0;0;0;0;0;0;0
O Pensamento masculino. Sem rodeios! Bem vindo você homem. Você mulher. #revelações Aguarde!;0;0;0;0;0;0;0;0;0;0;0;0
A @gleisi fazer greve...não trabalhar..É um alívio para o BRASIL... já que ela só faz atrapalhar o país mesmo. Devo _ https://t.co/EzKOlbn8YF;0;0;0;0;0;0;0;0;0;0;0;0
"O amigo passa o ano inteiro dizendo: ""aquela é puta"" ""gorda"" ""não pego pq é feia"" ""feminazi"" E AGORA VEM COM ESSA HIPOCRISIA";1;1;1;0;1;0;0;0;0;0;0;0
"o intelectual é um tipo k chega às mesmas conclusões do povo mas com uns anos de atraso
https://t.co/DMnpz8isTi";0;0;0;0;0;0;0;0;0;0;0;0
minha sala só tem sapatao;1;0;0;0;0;1;0;0;0;0;0;0
"ALÔ FEMINISTAS
ATÉ #JesusEstáVoltando
E O SEU PAI NÃO";1;1;0;0;1;0;0;0;0;0;0;0
"Vcs conhecem o Abraço cultural ?
não?! É um curso de idiomas onde prof são refugiados ! 
EU QUERO ME MATRICULAR AGORA.";0;0;0;0;0;0;0;0;0;0;0;0
Fufas de merda, atiram-se a tudo o que mexe.;1;0;0;0;0;1;0;0;0;0;0;0
Afffffff só por Deus eu te que fica olhando a funça da atual dá minha ex;0;0;0;0;0;0;0;0;0;0;0;0
@fjstex estás a insinuar que algarvios, alentejanos, comunas e fachos não passam de uma cambada de rabetas?!;1;0;0;0;0;1;0;0;0;0;0;0
"Bolsomito Kiridinha: ""Eu mesmo não acredito que isso ainda ocorra"", disse o deputado sobre a desigualdade salarial entre homens e mulheres.";1;1;0;0;0;0;0;0;0;0;0;0
O ruim de ter chileno branco é que depois de uns dias, ele fica preto;1;0;0;1;0;0;0;0;0;0;0;0
Espero que não seja o dia em que os 'refugiados' comecem também aqui sua sharia. https://t.co/UHswA3hGQN;1;0;0;0;0;0;0;0;0;0;1;0
Se fosse um homem, o Fisco, seria o + desejado pelas mulheres. É rico, escreve com regularidade e nunca se esquece das datas importantes!...;1;1;0;0;0;0;0;0;0;0;0;0
RT @chastinet: pro @homemdeverdade construção se resume a duas coisas: Concreto e madeira.;1;1;0;0;0;0;0;0;0;0;0;0
@gabrisinhas @LeoLimaDuarte vc acha que o racismo é culpa dos negros agora?;1;0;0;1;0;0;0;0;0;0;0;0
"NEYMAR FEZ O FAMOSO GOL ""OLHO AZUL EM GORDA""
BONITO, MAS NÃO SERVE PRA NADA";1;1;1;0;0;0;0;0;0;0;0;0
@belaaferaa aceitei pq sou uma sapatão sinistra;1;0;0;0;0;1;0;0;0;0;0;0
@adiosiago @amandassini quando branco acha que racismo é coitadismo só me dá mais vontade de continuar com o perfil;1;0;0;1;0;0;0;0;0;0;0;0
gorda e feia nao cabe na tela do celular de tão gorda https://t.co/FBL2xg6MwL;1;1;1;0;0;0;0;0;0;0;0;0
Quando vc descobre que aquela mina que vc conhece de vista é sapatão;1;0;0;0;0;1;0;0;0;0;0;0
"porque é que todas as fufas qd são mais novas dizem ser ""bi""?";1;0;0;0;0;1;0;0;0;0;0;0
Mulher burra fica pobre,mas eu vou te dizer se for inteligente pode até enriquecer. MINHA BUCETA É O PODERR;0;0;0;0;0;0;0;0;0;0;0;0
não! 1 coisa ñ elimina a outra! RT @Quase_Gay @agdabritto ain menina tenho entrevista d emprego semana que vem, vou sair da prostituição #rs;0;0;0;0;0;0;0;0;0;0;0;0
Mulher = carne de churrasco. Vc esquenta no pau;1;1;0;0;0;0;0;0;0;0;0;0
Até quando vamos deixar nos enfiarem goela adentro tanta corrupção? Não queremos refugiados de lugar nenhum!! Vamos pra rua gritar meu povo!;1;0;0;0;0;0;0;0;0;0;1;0
Puta saudade de postar uns bagulho machista nessa porra mas agora as mulheres aprenderam a ler;1;1;0;0;0;0;0;0;0;0;0;0
@_SsarahA @Ebandeira_ isso n ta errado, mas épesquisa de gente burra, a mulher trabalha menos que o homem;1;1;0;0;0;0;0;0;0;0;0;0
